{
  "formatVersion": 1,
  "releaseId": "catalog-000009",
  "catalogRevision": 9,
  "kind": "news",
  "locale": "it",
  "page": 2,
  "next": null,
  "items": [
    {
      "id": "ppsspp-pr-21788-detect-sprites-clip-them-slightly-to-a",
      "kind": "news",
      "contentVersion": 1,
      "localeVersion": 1,
      "title": "PPSSPP prende di mira le cuciture degli sprite di GTA al confine tra geometria e texel",
      "summary": "Un percorso di compatibilità riconosce gli sprite a due triangoli e spinge verso l'interno il loro bordo UV esterno, riducendo gli artefatti di upscaling senza indebolire globalmente il filtraggio delle texture.",
      "publishedAt": "2026-06-05T10:43:19Z",
      "updatedAt": "2026-08-09T12:00:00Z",
      "categoryIds": [
        "ppsspp",
        "graphics",
        "emulation"
      ],
      "tagIds": [
        "gta-sprites",
        "texture-filtering",
        "uv-coordinates"
      ],
      "relatedProductIds": [
        "ppsspp"
      ],
      "featured": false,
      "priority": 99,
      "canonicalUrl": "https://github.com/hrydgard/ppsspp/pull/21788",
      "heroAssetId": "ppsspp-pr-21788-detect-sprites-clip-them-slightly-to-a-hero",
      "document": {
        "path": "content/news/ppsspp-pr-21788-detect-sprites-clip-them-slightly-to-a/locales/it.json",
        "sha256": "e911048f138f79e5e3b995f91f959241f20fdd21cf38094b7b7c500e7bbfb0ee",
        "bytes": 4493,
        "contentType": "application/json"
      },
      "sourceCount": 1,
      "sources": [
        {
          "id": "ppsspp-pr-21788",
          "title": "GTA sprite fix: Detect sprites, clip them slightly to avoid filtering artifacts",
          "url": "https://github.com/hrydgard/ppsspp/pull/21788",
          "publisher": "PPSSPP",
          "publishedAt": "2026-06-05T10:43:19Z"
        }
      ]
    },
    {
      "id": "pcsx2-pr-14503-rov-support-for-feedback-draws",
      "kind": "news",
      "contentVersion": 1,
      "localeVersion": 1,
      "title": "PCSX2 porta i draw di feedback ordinati a tre backend hardware",
      "summary": "Esecuzione in stile ROV su Direct3D 11, Direct3D 12 e Vulkan riduce la divisione nel rendering con molto feedback, esponendo copie, barriere e limitazioni del backend per la convalida.",
      "publishedAt": "2026-06-03T01:26:25Z",
      "updatedAt": "2026-08-09T12:00:00Z",
      "categoryIds": [
        "pcsx2",
        "graphics",
        "emulation"
      ],
      "tagIds": [
        "rov",
        "feedback-loop",
        "draw-call-reduction"
      ],
      "relatedProductIds": [
        "pcsx2"
      ],
      "featured": false,
      "priority": 146,
      "canonicalUrl": "https://github.com/PCSX2/pcsx2/pull/14503",
      "heroAssetId": "pcsx2-pr-14503-rov-support-for-feedback-draws-hero",
      "document": {
        "path": "content/news/pcsx2-pr-14503-rov-support-for-feedback-draws/locales/it.json",
        "sha256": "3a01b027a776ad241868247e623aa041355e3423c25f39d204b254f1fb86521f",
        "bytes": 4108,
        "contentType": "application/json"
      },
      "sourceCount": 1,
      "sources": [
        {
          "id": "pcsx2-pr-14503",
          "title": "GS/HW: ROV support for feedback draws.",
          "url": "https://github.com/PCSX2/pcsx2/pull/14503",
          "publisher": "PCSX2",
          "publishedAt": "2026-06-03T01:26:25Z"
        }
      ]
    },
    {
      "id": "pcsx2-pr-14477-shader-copy-and-texture-format-handlin",
      "kind": "news",
      "contentVersion": 1,
      "localeVersion": 1,
      "title": "PCSX2 sposta la politica di conversione delle texture dietro GSDevice",
      "summary": "StretchRectAuto, CreateCompatible e ShaderConvertSelector riorganizzano la gestione della copia degli shader e del formato della profondità in modo che il renderer hardware possa richiedere una conversione senza conoscere i dettagli della pipeline di ciascun backend.",
      "publishedAt": "2026-05-31T16:43:01Z",
      "updatedAt": "2026-08-09T12:00:00Z",
      "categoryIds": [
        "pcsx2",
        "graphics",
        "emulation"
      ],
      "tagIds": [
        "shader-conversion",
        "texture-formats",
        "renderer-architecture"
      ],
      "relatedProductIds": [
        "pcsx2"
      ],
      "featured": false,
      "priority": 158,
      "canonicalUrl": "https://github.com/PCSX2/pcsx2/pull/14477",
      "heroAssetId": "pcsx2-pr-14477-shader-copy-and-texture-format-handlin-hero",
      "document": {
        "path": "content/news/pcsx2-pr-14477-shader-copy-and-texture-format-handlin/locales/it.json",
        "sha256": "990aa3ca35b3e5d00272107bd2f4191792754dac75b8ce0e1bfc5bd94fa10b53",
        "bytes": 4468,
        "contentType": "application/json"
      },
      "sourceCount": 1,
      "sources": [
        {
          "id": "pcsx2-pr-14477",
          "title": "GS/HW: Refactor shader copy and texture format handling.",
          "url": "https://github.com/PCSX2/pcsx2/pull/14477",
          "publisher": "PCSX2",
          "publishedAt": "2026-05-31T16:43:01Z"
        }
      ]
    },
    {
      "id": "vita3k-pr-3913-lle-kernel-module-sysmodule",
      "kind": "news",
      "contentVersion": 1,
      "localeVersion": 1,
      "title": "Vita3K collega i moduli kernel reali di Vita al proprio grafo di moduli emulati",
      "summary": "Il caricamento di boot e sysmodule SKPRX ora si unisce a un più ampio SELF, gestione dell'export dei driver, TLS, ciclo di vita e patch necessarie per un percorso di moduli di sistema a basso livello.",
      "publishedAt": "2026-05-27T17:02:08Z",
      "updatedAt": "2026-08-09T12:00:00Z",
      "categoryIds": [
        "vita3k",
        "core",
        "emulation"
      ],
      "tagIds": [
        "kernel-modules",
        "lle",
        "sysmodule"
      ],
      "relatedProductIds": [
        "vita3k"
      ],
      "featured": false,
      "priority": 54,
      "canonicalUrl": "https://github.com/Vita3K/Vita3K/pull/3913",
      "heroAssetId": "vita3k-pr-3913-lle-kernel-module-sysmodule-hero",
      "document": {
        "path": "content/news/vita3k-pr-3913-lle-kernel-module-sysmodule/locales/it.json",
        "sha256": "62a1a46d2920a833e174ace13043da060ca1b2fde7c43b14cc2d22be6fecc14c",
        "bytes": 4245,
        "contentType": "application/json"
      },
      "sourceCount": 1,
      "sources": [
        {
          "id": "vita3k-pr-3913",
          "title": "modules: lle kernel module \"sysmodule\"",
          "url": "https://github.com/Vita3K/Vita3K/pull/3913",
          "publisher": "Vita3K",
          "publishedAt": "2026-05-27T17:02:08Z"
        }
      ]
    },
    {
      "id": "vita3k-pr-3969-ngs-audio-state-ownership-some-cleanup",
      "kind": "news",
      "contentVersion": 1,
      "localeVersion": 1,
      "title": "Vita3K separa quattro tipi di stato all'interno del suo motore audio NGS",
      "summary": "Byte visibili agli ospiti, buffer temporanei, logica riprendibile e oggetti runtime dell'host ora hanno proprietari distinti, rendendo più facile ragionare sul routing vocale e sulla durata del decodificatore.",
      "publishedAt": "2026-05-26T03:33:52Z",
      "updatedAt": "2026-08-09T12:00:00Z",
      "categoryIds": [
        "vita3k",
        "audio",
        "emulation"
      ],
      "tagIds": [
        "ngs-audio",
        "state-ownership",
        "decoder-lifecycle"
      ],
      "relatedProductIds": [
        "vita3k"
      ],
      "featured": false,
      "priority": 55,
      "canonicalUrl": "https://github.com/Vita3K/Vita3K/pull/3969",
      "heroAssetId": "vita3k-pr-3969-ngs-audio-state-ownership-some-cleanup-hero",
      "document": {
        "path": "content/news/vita3k-pr-3969-ngs-audio-state-ownership-some-cleanup/locales/it.json",
        "sha256": "a7ba9c849c97d774a22581cdece6edd8f47a3a37c167c0ca0bbdc59246ac19fa",
        "bytes": 4499,
        "contentType": "application/json"
      },
      "sourceCount": 1,
      "sources": [
        {
          "id": "vita3k-pr-3969",
          "title": "ngs: refactor ngs/audio state ownership & some cleanup",
          "url": "https://github.com/Vita3K/Vita3K/pull/3969",
          "publisher": "Vita3K",
          "publishedAt": "2026-05-26T03:33:52Z"
        }
      ]
    },
    {
      "id": "pcsx2-pr-14450-track-shader-compile-count-and-duratio",
      "kind": "news",
      "contentVersion": 1,
      "localeVersion": 1,
      "title": "L'avviso dello shader di PCSX2 ora indica quanto lavoro è effettivamente stato completato",
      "summary": "L'overlay sostituisce un messaggio vago di compilazione con il numero di shader e i millisecondi totali, utilizzando un indicatore semplificato su Metal, Vulkan, OpenGL, Direct3D 11 e Direct3D 12.",
      "publishedAt": "2026-05-16T09:50:57Z",
      "updatedAt": "2026-08-09T12:00:00Z",
      "categoryIds": [
        "pcsx2",
        "tooling",
        "emulation"
      ],
      "tagIds": [
        "shader-compile",
        "osd",
        "startup-diagnostics"
      ],
      "relatedProductIds": [
        "pcsx2"
      ],
      "featured": false,
      "priority": 134,
      "canonicalUrl": "https://github.com/PCSX2/pcsx2/pull/14450",
      "heroAssetId": "pcsx2-pr-14450-track-shader-compile-count-and-duratio-hero",
      "document": {
        "path": "content/news/pcsx2-pr-14450-track-shader-compile-count-and-duratio/locales/it.json",
        "sha256": "7074b6ee4909508826c0aaef5fe568b73af59ed147303a42bef44c7e001ea18c",
        "bytes": 4008,
        "contentType": "application/json"
      },
      "sourceCount": 1,
      "sources": [
        {
          "id": "pcsx2-pr-14450",
          "title": "GS: Track shader compile count and duration for OSD",
          "url": "https://github.com/PCSX2/pcsx2/pull/14450",
          "publisher": "PCSX2",
          "publishedAt": "2026-05-16T09:50:57Z"
        }
      ]
    },
    {
      "id": "vita3k-pr-3805-vita3k-network-v3kn-cloud-save-manager",
      "kind": "news",
      "contentVersion": 1,
      "localeVersion": 1,